{
  "id": "crystal_magic_001",
  "prompt": "магический кристалл светящийся фиолетовым светом",
  "base": {
    "color": [0.6, 0.2, 0.9],
    "roughness": 0.05,
    "transparency": 0.6
  },
  "gradients": [
    {
      "axis": "y",
      "factor": 0.4,
      "color_shift": [0.2, 0.3, -0.1]
    },
    {
      "axis": "radial",
      "factor": 0.3,
      "color_shift": [-0.15, -0.1, 0.15]
    }
  ],
  "noise": {
    "type": "worley",
    "scale": 3.0,
    "octaves": 5,
    "persistence": 0.65
  },
  "physics": {
    "material": "crystal",
    "density": 3.2,
    "break_pattern": "shatter"
  },
  "meta": {
    "name": "Магический кристалл",
    "tags": ["crystal", "magic", "purple", "glowing", "fantasy"],
    "author": "isocubic"
  }
}
