{
  "id": "lava_molten_001",
  "prompt": "раскалённая лава с тёмной коркой и яркими трещинами",
  "base": {
    "color": [0.15, 0.05, 0.02],
    "roughness": 0.95,
    "transparency": 1.0
  },
  "gradients": [
    {
      "axis": "y",
      "factor": 0.5,
      "color_shift": [0.85, 0.3, 0.0]
    },
    {
      "axis": "radial",
      "factor": 0.3,
      "color_shift": [0.6, 0.15, 0.0]
    }
  ],
  "noise": {
    "type": "crackle",
    "scale": 7.0,
    "octaves": 4,
    "persistence": 0.75
  },
  "physics": {
    "material": "liquid",
    "density": 3.1,
    "break_pattern": "melt"
  },
  "meta": {
    "name": "Раскалённая лава",
    "tags": ["lava", "molten", "hot", "volcanic", "glowing"],
    "author": "isocubic"
  }
}
