{
  "id": "metal_rust_001",
  "prompt": "ржавый металл с патиной и царапинами",
  "base": {
    "color": [0.45, 0.35, 0.3],
    "roughness": 0.7,
    "transparency": 1.0
  },
  "gradients": [
    {
      "axis": "y",
      "factor": 0.25,
      "color_shift": [0.15, -0.05, -0.08]
    },
    {
      "axis": "x",
      "factor": 0.1,
      "color_shift": [-0.05, 0.02, 0.05]
    }
  ],
  "noise": {
    "type": "worley",
    "scale": 6.0,
    "octaves": 5,
    "persistence": 0.55
  },
  "physics": {
    "material": "metal",
    "density": 7.8,
    "break_pattern": "shatter"
  },
  "meta": {
    "name": "Ржавый металл",
    "tags": ["metal", "rust", "industrial", "weathered"],
    "author": "isocubic"
  }
}
